{
  "generated_at": "2026-05-25T16:04:17.476358+00:00",
  "tier": "tier_db_token_efficiency",
  "profile": "ci",
  "status": "measured",
  "metric": "tokens",
  "encoder": "tiktoken_cl100k_base",
  "baseline_surface": "sql",
  "sources": {
    "suite_toml": "benchmarks/tier_db_token_efficiency/suite.toml",
    "scenarios_json": "benchmarks/tier_db_token_efficiency/scenarios.json",
    "compute_script": "benchmarks/tier_db_token_efficiency/compute_tokens.py",
    "ecosystem_doc": "docs/ecosystem/tier-db-token-efficiency.md",
    "lidb_audit": "lidb/docs/liq-token-efficiency-audit.md"
  },
  "summary": {
    "scenario_count": 18,
    "sql_tokens_total": 629,
    "liq_tokens_total": 405,
    "liq_vs_sql_delta_pct_total": -35.6,
    "liq_vs_sql_compression_total": 1.553,
    "median_tokens_by_surface": {
      "drizzle": 43,
      "graphql": 33,
      "liq": 24,
      "liq_2step": 34,
      "postgrest": 23,
      "prisma": 35,
      "sql": 32,
      "supabase_js": 35
    }
  },
  "scenarios": [
    {
      "id": "list_packages_limit_20",
      "domain": "registry",
      "intent": "List packages, limit 20, stable order",
      "safety_note": "All surfaces parameterized or builder-typed; raw SQL needs allowlist validator.",
      "surfaces": {
        "sql": {
          "chars": 88,
          "tokens": 20,
          "text_preview": "SELECT id, name, description, created_at FROM public.packages ORDER BY name ASC LIMIT 20"
        },
        "liq": {
          "chars": 75,
          "tokens": 18,
          "text_preview": "read packages { id, name, description, created_at } order name asc limit 20"
        },
        "prisma": {
          "chars": 140,
          "tokens": 42,
          "text_preview": "await prisma.packages.findMany({ take: 20, orderBy: { name: 'asc' }, select: { id: true, name: true, description: true, \u2026"
        },
        "drizzle": {
          "chars": 170,
          "tokens": 38,
          "text_preview": "db.select({ id: packages.id, name: packages.name, description: packages.description, createdAt: packages.createdAt }).fr\u2026"
        },
        "supabase_js": {
          "chars": 113,
          "tokens": 31,
          "text_preview": "const { data } = await supabase.from('packages').select('id,name,description,created_at').order('name').limit(20)"
        },
        "postgrest": {
          "chars": 79,
          "tokens": 21,
          "text_preview": "/rest/v1/packages?select=id,name,description,created_at&order=name.asc&limit=20"
        },
        "graphql": {
          "chars": 89,
          "tokens": 24,
          "text_preview": "query { packages(limit: 20, order_by: { name: asc }) { id name description created_at } }"
        }
      },
      "vs_sql": {
        "liq": {
          "delta_pct": -10.0,
          "compression_ratio": 1.111
        },
        "prisma": {
          "delta_pct": 110.0,
          "compression_ratio": 0.476
        },
        "drizzle": {
          "delta_pct": 90.0,
          "compression_ratio": 0.526
        },
        "supabase_js": {
          "delta_pct": 55.0,
          "compression_ratio": 0.645
        },
        "postgrest": {
          "delta_pct": 5.0,
          "compression_ratio": 0.952
        },
        "graphql": {
          "delta_pct": 20.0,
          "compression_ratio": 0.833
        }
      }
    },
    {
      "id": "get_package_version_by_name_version",
      "domain": "registry",
      "intent": "Resolve package by name + semver version (single row)",
      "safety_note": "Name/version must be bound params, not interpolated.",
      "surfaces": {
        "sql": {
          "chars": 205,
          "tokens": 53,
          "text_preview": "SELECT pv.id, pv.version, pv.tree_digest, pv.proof_digest, pv.coverage_pct FROM public.package_versions pv INNER JOIN pu\u2026"
        },
        "liq": {
          "chars": 129,
          "tokens": 31,
          "text_preview": "read package_versions { id, version, tree_digest, proof_digest, coverage_pct } where package_id = $pkg and version = $ve\u2026"
        },
        "prisma": {
          "chars": 187,
          "tokens": 52,
          "text_preview": "await prisma.packageVersion.findFirst({ where: { version: ver, package: { name: pkgName } }, select: { id: true, version\u2026"
        },
        "drizzle": {
          "chars": 279,
          "tokens": 63,
          "text_preview": "db.select({ id: packageVersions.id, version: packageVersions.version, treeDigest: packageVersions.treeDigest }).from(pac\u2026"
        },
        "supabase_js": {
          "chars": 207,
          "tokens": 55,
          "text_preview": "const { data } = await supabase.from('package_versions').select('id,version,tree_digest,proof_digest,coverage_pct,packag\u2026"
        },
        "postgrest": {
          "chars": 154,
          "tokens": 42,
          "text_preview": "/rest/v1/package_versions?select=id,version,tree_digest,proof_digest,coverage_pct,packages!inner(name)&packages.name=eq.\u2026"
        },
        "graphql": {
          "chars": 158,
          "tokens": 44,
          "text_preview": "query($n:String!,$v:String!){ package_versions(where:{package:{name:{_eq:$n}},version:{_eq:$v}},limit:1){ id version tre\u2026"
        }
      },
      "vs_sql": {
        "liq": {
          "delta_pct": -41.5,
          "compression_ratio": 1.71
        },
        "prisma": {
          "delta_pct": -1.9,
          "compression_ratio": 1.019
        },
        "drizzle": {
          "delta_pct": 18.9,
          "compression_ratio": 0.841
        },
        "supabase_js": {
          "delta_pct": 3.8,
          "compression_ratio": 0.964
        },
        "postgrest": {
          "delta_pct": -20.8,
          "compression_ratio": 1.262
        },
        "graphql": {
          "delta_pct": -17.0,
          "compression_ratio": 1.205
        }
      }
    },
    {
      "id": "insert_publish_with_attestation",
      "domain": "registry",
      "intent": "Insert package_version + attestation row (publish gate fields)",
      "safety_note": "liq/ORM bind values; SQL uses $n placeholders only.",
      "surfaces": {
        "sql": {
          "chars": 288,
          "tokens": 78,
          "text_preview": "WITH ins AS (INSERT INTO public.package_versions (package_id, version, tree_digest, proof_digest, coverage_pct, publishe\u2026"
        },
        "liq": {
          "chars": 141,
          "tokens": 39,
          "text_preview": "insert package_versions { package_id: $pkg, version: $ver, tree_digest: $tree, proof_digest: $proof, coverage_pct: $cov,\u2026"
        },
        "prisma": {
          "chars": 226,
          "tokens": 55,
          "text_preview": "await prisma.$transaction([prisma.packageVersion.create({ data: { packageId, version, treeDigest, proofDigest, coverageP\u2026"
        },
        "drizzle": {
          "chars": 292,
          "tokens": 71,
          "text_preview": "db.transaction(async (tx) => { const [pv] = await tx.insert(packageVersions).values({ packageId, version, treeDigest, pr\u2026"
        },
        "supabase_js": {
          "chars": 269,
          "tokens": 66,
          "text_preview": "const { data: pv } = await supabase.from('package_versions').insert({ package_id, version, tree_digest, proof_digest, co\u2026"
        },
        "postgrest": {
          "chars": 90,
          "tokens": 26,
          "text_preview": "POST /rest/v1/package_versions + POST /rest/v1/attestations (two round-trips; bodies JSON)"
        },
        "graphql": {
          "chars": 162,
          "tokens": 41,
          "text_preview": "mutation($v:package_versions_insert_input!,$a:attestations_insert_input!){ insert_package_versions_one(object:$v){ id } \u2026"
        }
      },
      "vs_sql": {
        "liq": {
          "delta_pct": -50.0,
          "compression_ratio": 2.0
        },
        "prisma": {
          "delta_pct": -29.5,
          "compression_ratio": 1.418
        },
        "drizzle": {
          "delta_pct": -9.0,
          "compression_ratio": 1.099
        },
        "supabase_js": {
          "delta_pct": -15.4,
          "compression_ratio": 1.182
        },
        "postgrest": {
          "delta_pct": -66.7,
          "compression_ratio": 3.0
        },
        "graphql": {
          "delta_pct": -47.4,
          "compression_ratio": 1.902
        }
      }
    },
    {
      "id": "join_publisher_package",
      "domain": "registry",
      "intent": "Multi-table join publisher + package by package name",
      "safety_note": "liq v0: no JOIN \u2014 liq_2step is honest agent workaround.",
      "surfaces": {
        "sql": {
          "chars": 190,
          "tokens": 45,
          "text_preview": "SELECT pkg.id, pkg.name, pub.id AS publisher_id, pub.name AS publisher_name FROM public.packages pkg INNER JOIN public.p\u2026"
        },
        "liq": {
          "chars": 66,
          "tokens": 18,
          "text_preview": "read packages { id, name, publisher_id } where name = $pkg limit 1"
        },
        "liq_2step": {
          "chars": 121,
          "tokens": 34,
          "text_preview": "read packages { id, name, publisher_id } where name = $pkg limit 1 | read publishers { id, name } where id = $pub limit \u2026"
        },
        "prisma": {
          "chars": 122,
          "tokens": 35,
          "text_preview": "await prisma.package.findFirst({ where: { name: pkgName }, include: { publisher: { select: { id: true, name: true } } } \u2026"
        },
        "drizzle": {
          "chars": 218,
          "tokens": 53,
          "text_preview": "db.select({ packageId: packages.id, packageName: packages.name, publisherName: publishers.name }).from(packages).innerJo\u2026"
        },
        "supabase_js": {
          "chars": 125,
          "tokens": 35,
          "text_preview": "await supabase.from('packages').select('id,name,publisher_id,publishers(id,name)').eq('name', pkgName).limit(1).maybeSin\u2026"
        },
        "postgrest": {